{
  "checks": [
    {
      "check_id": "all_205_isolation_families_covered",
      "status": "pass"
    },
    {
      "check_id": "assigned_family_counts_39_15_40",
      "status": "pass"
    },
    {
      "check_id": "split_family_sets_disjoint",
      "status": "pass"
    },
    {
      "check_id": "train_family_qlora_eligibility",
      "status": "pass"
    },
    {
      "check_id": "development_family_pair_eligibility",
      "status": "pass"
    },
    {
      "check_id": "test_family_pair_eligibility",
      "status": "pass"
    },
    {
      "check_id": "same_axis_not_opposite_excluded_from_eval",
      "status": "pass"
    },
    {
      "check_id": "one_split_per_isolation_family",
      "status": "pass"
    },
    {
      "check_id": "raw_text_absent_from_tracked_manifest",
      "status": "pass"
    },
    {
      "check_id": "local_artifact_hashes_recorded",
      "status": "pass"
    },
    {
      "check_id": "allocation_deterministic_and_label_content_blind",
      "status": "pass"
    }
  ],
  "claim_boundary": "This tracked manifest freezes family ownership and local raw artifact hashes under the amended 39/15/40 standard. It is data infrastructure, not model or causal steering evidence.",
  "contract": {
    "path": "configs/research/phase_3_family_split_contract_v0_1.json",
    "sha256": "12bc354c446a79436afcb41cde121b6007f34e2c99cfa53d1caca2e45f8aaaba"
  },
  "counts": {
    "assigned_families": 94,
    "development_families": 15,
    "development_pair_rows": 18,
    "held_out_test_families": 40,
    "held_out_test_pair_rows": 52,
    "not_selected_ineligible_families": 111,
    "total_isolation_families": 205,
    "train_families": 39,
    "train_response_rows": 65
  },
  "local_artifacts": {
    "development": {
      "path": "results/local_artifacts/research_foundation/phase_3/phase_3_development_pairs_v0_1.jsonl",
      "row_count": 18,
      "sha256": "435f60fdac44869e39404327ffa151266782b27186e33f87a9782bc214ab03e3",
      "tracked": false
    },
    "held_out_test": {
      "path": "results/local_artifacts/research_foundation/phase_3/phase_3_held_out_test_pairs_v0_1.jsonl",
      "row_count": 52,
      "sha256": "ca73552381c223564bdbbb8135379087288bc13009805fe896d34fca7fe7caba",
      "tracked": false
    },
    "train": {
      "path": "results/local_artifacts/research_foundation/phase_3/phase_3_qlora_train_v0_1.jsonl",
      "row_count": 65,
      "sha256": "e6d3bbfbfda3f026dcacf20e1babcf9d2ffbb1442638ebdbb9dcb6925953bb56",
      "tracked": false
    }
  },
  "manifest_version": "phase_3_family_split_v0_1",
  "records": [
    {
      "candidate_ids": [
        "p3fam_8b9b22104d8ba682f7d6"
      ],
      "cohorts": [
        "expansion_60"
      ],
      "component_size": 1,
      "evaluation_eligible_candidate_ids": [],
      "final_isolation_family_id": "p3iso_034a29c85473a98250bb",
      "qlora_eligible_response_ids": [],
      "source_model_families": [
        "Alpaca2-7B"
      ],
      "split": "not_selected_ineligible"
    },
    {
      "candidate_ids": [
        "p3fam_3dfb138e6c3f446e67c9",
        "p3fam_49d53fb735a364e86912"
      ],
      "cohorts": [
        "additional_30_v0_3",
        "confirmed_180"
      ],
      "component_size": 2,
      "evaluation_eligible_candidate_ids": [
        "p3fam_3dfb138e6c3f446e67c9"
      ],
      "final_isolation_family_id": "p3iso_049a26e512ed4aa8a030",
      "qlora_eligible_response_ids": [
        "p3fam_3dfb138e6c3f446e67c9:response_1",
        "p3fam_49d53fb735a364e86912:response_0",
        "p3fam_49d53fb735a364e86912:response_1"
      ],
      "source_model_families": [
        "Alpaca-7B",
        "Alpaca2-7B"
      ],
      "split": "train"
    },
    {
      "candidate_ids": [
        "p3fam_05b2c005604d5afaa287",
        "p3fam_ae29f8ba4ef36ea7d897"
      ],
      "cohorts": [
        "confirmed_180"
      ],
      "component_size": 2,
      "evaluation_eligible_candidate_ids": [],
      "final_isolation_family_id": "p3iso_0509ff6bc967ebaa10f8",
      "qlora_eligible_response_ids": [
        "p3fam_ae29f8ba4ef36ea7d897:response_0",
        "p3fam_ae29f8ba4ef36ea7d897:response_1"
      ],
      "source_model_families": [
        "Alpaca-7B",
        "Alpaca3-8B"
      ],
      "split": "train"
    },
    {
      "candidate_ids": [
        "p3fam_94fe7169e04dbfc1ea86"
      ],
      "cohorts": [
        "expansion_60"
      ],
      "component_size": 1,
      "evaluation_eligible_candidate_ids": [],
      "final_isolation_family_id": "p3iso_066f4d51b1b39186635c",
      "qlora_eligible_response_ids": [],
      "source_model_families": [
        "Alpaca2-7B"
      ],
      "split": "not_selected_ineligible"
    },
    {
      "candidate_ids": [
        "p3fam_d6a64bca90d980c1cd63"
      ],
      "cohorts": [
        "confirmed_180"
      ],
      "component_size": 1,
      "evaluation_eligible_candidate_ids": [],
      "final_isolation_family_id": "p3iso_0a359a570e3ad9b37716",
      "qlora_eligible_response_ids": [
        "p3fam_d6a64bca90d980c1cd63:response_0",
        "p3fam_d6a64bca90d980c1cd63:response_1"
      ],
      "source_model_families": [
        "Alpaca-7B"
      ],
      "split": "train"
    },
    {
      "candidate_ids": [
        "p3fam_164706c1a1f8b1025055"
      ],
      "cohorts": [
        "expansion_60"
      ],
      "component_size": 1,
      "evaluation_eligible_candidate_ids": [],
      "final_isolation_family_id": "p3iso_0d5e3d26ffb8f3fb4d7e",
      "qlora_eligible_response_ids": [],
      "source_model_families": [
        "Alpaca3-8B"
      ],
      "split": "not_selected_ineligible"
    },
    {
      "candidate_ids": [
        "p3fam_a2014adcf103296f453c"
      ],
      "cohorts": [
        "expansion_60"
      ],
      "component_size": 1,
      "evaluation_eligible_candidate_ids": [
        "p3fam_a2014adcf103296f453c"
      ],
      "final_isolation_family_id": "p3iso_107ccd6a1149baaa1fc8",
      "qlora_eligible_response_ids": [
        "p3fam_a2014adcf103296f453c:response_1"
      ],
      "source_model_families": [
        "Alpaca2-7B"
      ],
      "split": "train"
    },
    {
      "candidate_ids": [
        "p3fam_2fddc25cc497a910c0fc"
      ],
      "cohorts": [
        "confirmed_180"
      ],
      "component_size": 1,
      "evaluation_eligible_candidate_ids": [],
      "final_isolation_family_id": "p3iso_10aa0a7a0ecda9ff57e7",
      "qlora_eligible_response_ids": [],
      "source_model_families": [
        "Alpaca-7B"
      ],
      "split": "not_selected_ineligible"
    },
    {
      "candidate_ids": [
        "p3fam_562e7205807e641ca864"
      ],
      "cohorts": [
        "confirmed_180"
      ],
      "component_size": 1,
      "evaluation_eligible_candidate_ids": [
        "p3fam_562e7205807e641ca864"
      ],
      "final_isolation_family_id": "p3iso_10c670e0b24f2f020b21",
      "qlora_eligible_response_ids": [
        "p3fam_562e7205807e641ca864:response_1"
      ],
      "source_model_families": [
        "Alpaca3-8B"
      ],
      "split": "development"
    },
    {
      "candidate_ids": [
        "p3fam_4e8c21cbf2e5504f6204"
      ],
      "cohorts": [
        "confirmed_180"
      ],
      "component_size": 1,
      "evaluation_eligible_candidate_ids": [
        "p3fam_4e8c21cbf2e5504f6204"
      ],
      "final_isolation_family_id": "p3iso_10ed46cce3b9909d079f",
      "qlora_eligible_response_ids": [
        "p3fam_4e8c21cbf2e5504f6204:response_1"
      ],
      "source_model_families": [
        "Alpaca2-7B"
      ],
      "split": "held_out_test"
    },
    {
      "candidate_ids": [
        "p3fam_034e5d823c7d9198981a"
      ],
      "cohorts": [
        "expansion_60"
      ],
      "component_size": 1,
      "evaluation_eligible_candidate_ids": [
        "p3fam_034e5d823c7d9198981a"
      ],
      "final_isolation_family_id": "p3iso_127cd134d5bed9ed750c",
      "qlora_eligible_response_ids": [
        "p3fam_034e5d823c7d9198981a:response_1"
      ],
      "source_model_families": [
        "Alpaca3-8B"
      ],
      "split": "held_out_test"
    },
    {
      "candidate_ids": [
        "p3fam_4437e87cd8dcae2d2251",
        "p3fam_9c3643b6b9ac9afb8440"
      ],
      "cohorts": [
        "confirmed_180",
        "expansion_60"
      ],
      "component_size": 2,
      "evaluation_eligible_candidate_ids": [
        "p3fam_9c3643b6b9ac9afb8440"
      ],
      "final_isolation_family_id": "p3iso_145d226c350f378f0681",
      "qlora_eligible_response_ids": [
        "p3fam_9c3643b6b9ac9afb8440:response_1"
      ],
      "source_model_families": [
        "Alpaca-7B",
        "Alpaca3-8B"
      ],
      "split": "held_out_test"
    },
    {
      "candidate_ids": [
        "p3fam_6982e71e9041a0b65dce"
      ],
      "cohorts": [
        "confirmed_180"
      ],
      "component_size": 1,
      "evaluation_eligible_candidate_ids": [],
      "final_isolation_family_id": "p3iso_1469a077b2487ffe7ae2",
      "qlora_eligible_response_ids": [],
      "source_model_families": [
        "Alpaca2-7B"
      ],
      "split": "not_selected_ineligible"
    },
    {
      "candidate_ids": [
        "p3fam_6f7a2d25318b624c8a3d",
        "p3fam_e9d5d83b74afcdc4ddaa"
      ],
      "cohorts": [
        "confirmed_180",
        "supplemental_12_v0_4"
      ],
      "component_size": 2,
      "evaluation_eligible_candidate_ids": [
        "p3fam_e9d5d83b74afcdc4ddaa"
      ],
      "final_isolation_family_id": "p3iso_14766037b0a8be1a07c8",
      "qlora_eligible_response_ids": [
        "p3fam_e9d5d83b74afcdc4ddaa:response_0"
      ],
      "source_model_families": [
        "Alpaca-7B"
      ],
      "split": "held_out_test"
    },
    {
      "candidate_ids": [
        "p3fam_86fcedeab7044237be3e"
      ],
      "cohorts": [
        "confirmed_180"
      ],
      "component_size": 1,
      "evaluation_eligible_candidate_ids": [
        "p3fam_86fcedeab7044237be3e"
      ],
      "final_isolation_family_id": "p3iso_14c14412c3c9cc85b2d0",